{
  "schema": "sentinel-rulepack/draft-1",
  "packId": "sentinel-secrets",
  "version": "0.1.0",
  "rights": {
    "spdx": "MIT",
    "origin": "sentinel-original"
  },
  "rules": [
    {
      "familyId": "sentinel.secrets.current-tree",
      "revision": 1,
      "titleKey": "sentinel.drivers.rule.currentTreeSecrets",
      "applicability": {
        "languages": [
          "typescript",
          "javascript",
          "java"
        ],
        "scopeKind": "repository"
      },
      "requires": [
        "source-bytes"
      ],
      "implementation": {
        "adapterId": "secrets-gitleaks",
        "rulePath": "detectors/gitleaks-current-tree.json"
      },
      "meaning": "candidate",
      "severity": "high",
      "evidenceRequired": [
        "source-span"
      ],
      "limitationKeys": [
        "sentinel.secrets.valueWithheld",
        "sentinel.secrets.lineLocation"
      ],
      "mappings": {
        "cwe": []
      },
      "fixtures": {
        "positive": [
          "fixtures/positive-parts.fixture"
        ],
        "negative": [
          "fixtures/safe-text.fixture"
        ]
      }
    }
  ]
}
